{
  "metadata": {
    "grade": 12,
    "unit_number": 1,
    "unit_id": "g12-u01",
    "title": "LIFE STORIES WE ADMIRE",
    "topic": "Biographies, Role Models, Overcoming Adversity and Great Achievements",
    "source_file": "Sách học sinh Tiếng anh 12 - Global success.pdf",
    "pdf_page": 8,
    "book_page": 8,
    "source_section": "Grade 12 Unit 1 Overview & Book Map p.4",
    "provenance": "extracted",
    "ocr_confidence": 0.97,
    "review_status": "verified",
    "sections": [
      {
        "section_name": "Getting Started",
        "book_page_start": 8,
        "book_page_end": 9,
        "pdf_page_start": 8,
        "pdf_page_end": 9,
        "description": "Introduction dialogue for LIFE STORIES WE ADMIRE"
      },
      {
        "section_name": "Language",
        "book_page_start": 10,
        "book_page_end": 10,
        "pdf_page_start": 10,
        "pdf_page_end": 10,
        "description": "Pronunciation (Diphthongs: /eɪ/ and /aʊ/), Vocabulary and Grammar"
      },
      {
        "section_name": "Reading",
        "book_page_start": 11,
        "book_page_end": 12,
        "pdf_page_start": 11,
        "pdf_page_end": 12,
        "description": "The Visionary Life of Steve Jobs"
      },
      {
        "section_name": "Speaking",
        "book_page_start": 12,
        "book_page_end": 12,
        "pdf_page_start": 12,
        "pdf_page_end": 12,
        "description": "Presenting inspiring life milestones of prominent national heroes of Viet Nam"
      },
      {
        "section_name": "Listening",
        "book_page_start": 13,
        "book_page_end": 13,
        "pdf_page_start": 13,
        "pdf_page_end": 13,
        "description": "Listening to a documentary segment on Walt Disney's creative persistence"
      },
      {
        "section_name": "Writing",
        "book_page_start": 14,
        "book_page_end": 15,
        "pdf_page_start": 14,
        "pdf_page_end": 15,
        "description": "Synthesising facts from chronological notes to write a biographical profile"
      },
      {
        "section_name": "Communication & Culture",
        "book_page_start": 16,
        "book_page_end": 16,
        "pdf_page_start": 16,
        "pdf_page_end": 16,
        "description": "Everyday English and cultural study"
      },
      {
        "section_name": "Looking Back & Project",
        "book_page_start": 17,
        "book_page_end": 17,
        "pdf_page_start": 17,
        "pdf_page_end": 17,
        "description": "Review and group research presentation"
      }
    ],
    "learning_objectives": {
      "vocabulary": "Words and phrases related to biographies, role models, overcoming adversity and great achievements",
      "grammar": [
        "Past Simple vs. Past Continuous (Narrative)"
      ],
      "pronunciation": "Diphthongs: /eɪ/ and /aʊ/",
      "reading": "The Visionary Life of Steve Jobs",
      "speaking": "Presenting inspiring life milestones of prominent national heroes of Viet Nam",
      "listening": "Listening to a documentary segment on Walt Disney's creative persistence",
      "writing": "Synthesising facts from chronological notes to write a biographical profile"
    }
  },
  "vocabulary": [
    {
      "id": "g12-u01-vocab-001",
      "unit_id": "g12-u01",
      "word": "biography",
      "word_type": "noun",
      "ipa": "/baɪˈɒɡrəfi/",
      "meaning_vi": "tiểu sử, truyện danh nhân",
      "definition_en": "an account of someone's life written by someone else",
      "example_sentence": "Reading Steve Jobs' biography inspires young entrepreneurs.",
      "example_translation": "Đọc tiểu sử Steve Jobs truyền cảm hứng cho các doanh nhân trẻ.",
      "collocations": [
        "write a biography"
      ],
      "source_file": "Sách học sinh Tiếng anh 12 - Global success.pdf",
      "pdf_page": 10,
      "book_page": 10,
      "source_section": "Grade 12 Unit 1 Language & Glossary",
      "provenance": "extracted",
      "ocr_confidence": 0.96,
      "review_status": "verified"
    },
    {
      "id": "g12-u01-vocab-002",
      "unit_id": "g12-u01",
      "word": "admire",
      "word_type": "verb",
      "ipa": "/ədˈmaɪə(r)/",
      "meaning_vi": "ngưỡng mộ, khâm phục",
      "definition_en": "to regard with respect or warm approval",
      "example_sentence": "We admire Uncle Ho for his devotion to national independence.",
      "example_translation": "Chúng ta ngưỡng mộ Bác Hồ vì sự cống hiến trọn đời cho độc lập dân tộc.",
      "collocations": [
        "greatly admire"
      ],
      "source_file": "Sách học sinh Tiếng anh 12 - Global success.pdf",
      "pdf_page": 10,
      "book_page": 10,
      "source_section": "Grade 12 Unit 1 Language & Glossary",
      "provenance": "extracted",
      "ocr_confidence": 0.96,
      "review_status": "verified"
    },
    {
      "id": "g12-u01-vocab-003",
      "unit_id": "g12-u01",
      "word": "achievement",
      "word_type": "noun",
      "ipa": "/əˈtʃiːvmənt/",
      "meaning_vi": "thành tựu, chiến tích",
      "definition_en": "a thing done successfully typically by effort, courage, or skill",
      "example_sentence": "Winning the Nobel Prize was her greatest scientific achievement.",
      "example_translation": "Đoạt giải Nobel là thành tựu khoa học vĩ đại nhất của bà.",
      "collocations": [
        "remarkable achievement"
      ],
      "source_file": "Sách học sinh Tiếng anh 12 - Global success.pdf",
      "pdf_page": 10,
      "book_page": 10,
      "source_section": "Grade 12 Unit 1 Language & Glossary",
      "provenance": "extracted",
      "ocr_confidence": 0.96,
      "review_status": "verified"
    },
    {
      "id": "g12-u01-vocab-004",
      "unit_id": "g12-u01",
      "word": "genius",
      "word_type": "noun",
      "ipa": "/ˈdʒiːniəs/",
      "meaning_vi": "thiên tài",
      "definition_en": "exceptional intellectual or creative power or other natural ability",
      "example_sentence": "Albert Einstein was recognized as a mathematical and physics genius.",
      "example_translation": "Albert Einstein được công nhận là một thiên tài toán học và vật lý.",
      "collocations": [
        "creative genius"
      ],
      "source_file": "Sách học sinh Tiếng anh 12 - Global success.pdf",
      "pdf_page": 10,
      "book_page": 10,
      "source_section": "Grade 12 Unit 1 Language & Glossary",
      "provenance": "extracted",
      "ocr_confidence": 0.96,
      "review_status": "verified"
    },
    {
      "id": "g12-u01-vocab-005",
      "unit_id": "g12-u01",
      "word": "overcome",
      "word_type": "verb",
      "ipa": "/ˌəʊvəˈkʌm/",
      "meaning_vi": "vượt qua (nghịch cảnh, khó khăn)",
      "definition_en": "to succeed in dealing with a problem or difficulty",
      "example_sentence": "Helen Keller overcame blindness and deafness to become a famous author.",
      "example_translation": "Helen Keller đã vượt qua mù và điếc để trở thành một tác giả nổi tiếng.",
      "collocations": [
        "overcome hardship"
      ],
      "source_file": "Sách học sinh Tiếng anh 12 - Global success.pdf",
      "pdf_page": 10,
      "book_page": 10,
      "source_section": "Grade 12 Unit 1 Language & Glossary",
      "provenance": "extracted",
      "ocr_confidence": 0.96,
      "review_status": "verified"
    },
    {
      "id": "g12-u01-vocab-006",
      "unit_id": "g12-u01",
      "word": "persistence",
      "word_type": "noun",
      "ipa": "/pəˈsɪstəns/",
      "meaning_vi": "sự kiên trì, bền bỉ",
      "definition_en": "firm or obstinate continuance in a course of action in spite of difficulty",
      "example_sentence": "Walt Disney's persistence turned repeated business failures into global success.",
      "example_translation": "Sự kiên trì của Walt Disney đã biến những thất bại kinh doanh liên tiếp thành thành công toàn cầu.",
      "collocations": [
        "determination and persistence"
      ],
      "source_file": "Sách học sinh Tiếng anh 12 - Global success.pdf",
      "pdf_page": 10,
      "book_page": 10,
      "source_section": "Grade 12 Unit 1 Language & Glossary",
      "provenance": "extracted",
      "ocr_confidence": 0.96,
      "review_status": "verified"
    }
  ],
  "grammar": [
    {
      "id": "g12-u01-grammar-001",
      "unit_id": "g12-u01",
      "title": "Past Simple vs. Past Continuous (Narrative)",
      "structure_name": "Quá khứ đơn vs. Quá khứ tiếp diễn trong kể chuyện",
      "rule_summary": "Quá khứ tiếp diễn (was/were + V-ing) mô tả bối cảnh hoặc hành động đang diễn ra kéo dài; Quá khứ đơn (V2/ed) mô tả chuỗi sự kiện chính hoặc hành động bất ngờ xen ngang.",
      "formula": "Past Continuous for background scene | Past Simple for main event sequence",
      "example_sentences": [
        {
          "en": "While Steve Jobs was studying typography, he had no idea it would revolutionize computer fonts.",
          "vi": "Khi Steve Jobs đang theo học thư pháp, ông không ngờ nó sẽ làm cách mạng hóa phông chữ máy tính."
        },
        {
          "en": "The telephone rang while she was drafting her first historical novel.",
          "vi": "Chuông điện thoại reo khi cô đang phác thảo cuốn tiểu thuyết lịch sử đầu tay."
        }
      ],
      "common_mistakes": [
        {
          "mistake": "While she was cooking, she was dropping the vase.",
          "correction": "While she was cooking, she dropped the vase.",
          "explanation": "Hành động bất ngờ làm rơi bình (dropped) dùng Quá khứ đơn."
        }
      ],
      "source_file": "Sách học sinh Tiếng anh 12 - Global success.pdf",
      "pdf_page": 10,
      "book_page": 10,
      "source_section": "Grade 12 Unit 1 Language - Grammar",
      "provenance": "extracted",
      "ocr_confidence": 0.96,
      "review_status": "verified"
    }
  ],
  "reading": {
    "id": "g12-u01-reading-001",
    "unit_id": "g12-u01",
    "topic": "The Visionary Life of Steve Jobs",